{"schemaVersion":"1.0.0","generatedAt":"2026-09-24T03:28:23.087Z","source":{"spreadsheet":"DTM 所有プラグインリスト","sheet":"所有プラグイン"},"plugins":[{"id":"air-music-tech-flavor-pro","developer":"AIR Music Tech","productName":"Flavor Pro","mainCategory":"エフェクター","subCategory":"マルチエフェクト","summary":"レコード、テープ、チューブなどの質感を再現するLo-Fiエフェクト。","usage":"【素材の偽ヴィンテージ化】 ドラムループやVocal Chopsに薄く挿し、レコード、テープ、チューブの質感を組み合わせて「古い媒体から抜いた素材」に寄せる。RC-20より素早く複数の年代感を試す入口として使う。"},{"id":"air-music-tech-fly-tape-ii","developer":"AIR Music Tech","productName":"Fly Tape II","mainCategory":"エフェクター","subCategory":"マルチエフェクト","summary":"「質感付加」に加え、**「リアルタイム・パフォーマンス」**に特化したLo-Fiマルチエフェクト","usage":"【リアルタイムのテープ・グリッチ】 Vocal Chopsやブレイクに挿し、テープ停止、スタッター、フィルターをオートメーションしてJet Set Funkの切り返しを作る。定常的な汚しより、展開用の瞬間操作に向く。"},{"id":"air-music-tech-jura-chorus","developer":"AIR Music Tech","productName":"JURA Chorus","mainCategory":"エフェクター","subCategory":"コーラス","summary":"Roland Junoの象徴的なコーラスエフェクトを再現。","usage":"【80sの横幅と艶】 パッド、ストリングス、クリーンなシンセに薄く加え、Juno系の広がりを付与する。PCMロンプラー音色を80年代ポップ／アーケードゲーム風に馴染ませる用途にも有効。"},{"id":"air-music-tech-msxii-lo-fly-dirt","developer":"AIR Music Tech","productName":"MSXII Lo-fly Dirt","mainCategory":"エフェクター","subCategory":"マルチエフェクト","summary":"Lo-Fiサウンドに特化したマルチエフェクト。ビンテージ感を演出。","usage":"【粗いサンプル感の付加】 ドラム、ベース、声ネタに挿して歪み、ノイズ、フィルターで輪郭を崩す。RX950やDecimort 2の前後で使い、単なるビット低下とは異なる汚れを足す。"},{"id":"antelope-audio-bae-1073mp","developer":"Antelope Audio","productName":"BAE-1073MP","mainCategory":"エフェクター","subCategory":"プリアンプ / サチュレーター","summary":"BAE社製1073マイクプリアンプの質感を再現。EQを排し、純粋な増幅回路の「色」のみを追求したモデル。","usage":"【音の土台を「太く」硬める】 EQで補正する前段階として、ドラムバスや自作Vocal Chopsの先頭に挿入。Inputを上げていくことで得られる、Neve系特有の濃密な倍音と音楽的な飽和感を加えます。デジタル臭いシンセ音に、実機を通したような重厚な「押し出し感」を与える隠し味として使用。"},{"id":"antelope-audio-stay-levin","developer":"Antelope Audio","productName":"Stay-Levin","mainCategory":"エフェクター","subCategory":"コンプレッサー / 真空管Vari-Mu","summary":"1960年代アメリカン真空管コンプレッサーをモチーフにした、シンプル操作のVari-Mu系コンプレッサー。滑らかなレベリングだけでなく、Inputを押し込むことで古い機材を通したような太さ、密度、軽い荒さを付加できる。","usage":"【声ネタと単体素材の古い押し出し】 自作Vocal Chops、ベース、スネア、シンセリードに挿入。Fairchild 670 Legacyよりも気軽なキャラ付け用として、素材を「古いレコード由来のサンプル」のように太く前に出す。RX1200 / Decimort 2 の後段に置くと、12bit系のジャリ感を真空管コンプ的にまとめ、Jet Set Funk / PCMグルーヴの偽サンプル化工程で有効。"},{"id":"antelope-audio-springer","developer":"Antelope Audio","productName":"Springer","mainCategory":"エフェクター","subCategory":"リバーブ / スプリングリバーブ","summary":"アナログ・スプリングタンクの機械的な響きを再現する、キャラクター重視のスプリングリバーブ。金属的な倍音、バネ特有のビヨンとした共振、ローファイな揺らぎを持ちながら、Tank Size、Tension、Density、Damping、Tone、Pre-Delay、Stereo Depth などで現代的に細かく調整できる。","usage":"【古い機材感と飛び道具的な空間】 ギター、シンセリード、オルガン、ボーカルチョップ、ダブ的なワンショットに使用。プレートやLexicon系の高級な残響ではなく、バネが鳴っているような金属的で狭い空間を足したい時に挿入する。Jet Set Funk / PCMグルーヴでは、声ネタやシンセフレーズを「古いアンプや機材を通したサンプル」のように汚し、GameVerbやGalaxy Tape Echoとは違う、ビヨンと跳ねるレトロな違和感を演出する。"},{"id":"antelope-audio-mg4","developer":"Antelope Audio","productName":"MG4+","mainCategory":"エフェクター","subCategory":"EQ / 6バンド・エアバンドEQ","summary":"伝説的な500シリーズEQをモチーフにした6バンドEQ。Sub、40Hz、160Hz、650Hz、2.5kHzに加え、独特の「Sky Band」で高域に高級感のある艶と空気感を付加できる。位相変化を抑えたクリアな処理が特徴で、ボーカルやシンセ、アコースティック素材の抜けを耳に痛くならない形で引き上げる。","usage":"【高域の艶と“完成品感”を足す】 ボーカル、Vocal Chops、シンセリード、エレピ、ブラス、2mix前のバスに使用。PultecやMassive Passiveよりも素早く「上だけ高級にする」用途に向き、Jet Set Funk / PCMグルーヴでは、RX1200 / Decimort 2 で荒らした素材の最後にSky Bandを薄く足して、古いサンプルに現代的な抜けを与える。Avalon VT-737が光沢担当（点）なら、MG4+は高域の空気だけを素早く足す仕上げ用EQ。"},{"id":"armory-turntablesaw","developer":"Armory","productName":"TurnTableSaw","mainCategory":"シンセサイザー / DJスクラッチ","subCategory":"DJスクラッチ","summary":"鋸歯状の波形で音を切り裂く、過激なスクラッチ演出用。実機の挙動を超えた破壊的音色。","usage":"【斬撃的スクラッチ】長沼英樹風の「チャカチャカ」した質感を強調したい時に。自分の声を録音したVocal Chopsに適用し、16分音符で細かく刻むことで、人間の発声と機械的なノイズが混ざり合うカオティックなリフを生成する。"},{"id":"audiorealism-redominator","developer":"AudioRealism","productName":"ReDominator","mainCategory":"シンセサイザー / 音源","subCategory":"シンセサイザー","summary":"Roland Alpha Juno (HS-80)を再現。有名なHooverサウンドや80sパッド。","usage":"【レイヴPCMの主役作り】 Hoover、スタブ、ブラス、硬いパッドを作り、短くバウンスして再サンプリングする。Rave Generator 3が即戦力PCMなら、こちらはAlpha Juno系音色を自作する担当。"},{"id":"audiothing-megaphone","developer":"AudioThing","productName":"Megaphone","mainCategory":"エフェクター","subCategory":"Lo-Fi / Distortion","summary":"安っぽいプラスチック筐体の拡声器（メガホン）サウンドを完全再現。単なるラジオボイスEQとは一線を画す、スピーカーの「ビビリ」や「フィードバックハウリング」までシミュレート可能。","usage":"【拡声器ボイスと飛び道具】 Vocal Chopsや掛け声に挿し、帯域制限、ノイズ、フィードバックで街頭PA風に加工する。Jet Set Funkのコールやゲーム内アナウンスを前景化する用途に向く。"},{"id":"audiothing-minibit","developer":"AudioThing","productName":"miniBit","mainCategory":"シンセサイザー / 音源","subCategory":"チップチューンシンセ","summary":"80年代ゲーム機やレトロPCのサウンドをエミュレートした8bitシンセ。非帯域制限のエイリアシングが特徴。","usage":"【ゲームサウンドの基礎】 Chiptune Lo-Fi HipHopにおけるメインメロディやベースラインの生成に使用。高速ファンクのドラムに重ねて、短いノイズ音を出すなど、長沼英樹サウンドの「荒いサンプリング感」を表現するためのテクスチャ音源としても有用。"},{"id":"audiothing-things-flip-eq","developer":"AudioThing","productName":"Things Flip EQ","mainCategory":"エフェクター","subCategory":"EQ（チルトEQ）","summary":"M/S処理を備えたシンプルなチルトEQ。ノブ一つで高音と低音のバランスを反転させる。","usage":"【一発で年代感を調整】バスやマスターに使用し、高域を抑えつつ低域を強調することで、80sのテープを通したようなマイルドでダークな音像に素早く調整する。Future Funkの楽曲で、キックとハイハットの立ち上がりを微調整するのにも便利。"},{"id":"audiothing-things-texture","developer":"AudioThing","productName":"Things Texture","mainCategory":"エフェクター","subCategory":"リバーブ／グラニュラー","summary":"ピッチシフトとM/S処理を搭載した、シンプルなグラニュラーリバーブ。インディーゲーム「The Swapper」のサウンドデザインに着想。","usage":"【アンビエントな残響】チップチューン音源やサンプリング音源のシグナルに混ぜ、ピッチを揺らしながら広大でノイジーな空間を創造する。Lo-Fi HipHopのビートにドローン的な「雰囲気」を加えるのに最適。"},{"id":"audiothing-valves","developer":"AudioThing","productName":"Valves","mainCategory":"エフェクター","subCategory":"サチュレーション／オーバードライブ","summary":"ビンテージ真空管回路のエミュレーション（三極管/五極管選択可）に、クラシックなアナログフィルターとキャビネットシミュレーターを統合したマルチエフェクト。","usage":"【80sの血肉を与える】シンセサイザーやドラムバスに挿入し、適度な真空管の温かみ（トライオード）や、荒々しい歪み（ペントード）を付加する。フィルターセクションを使い、高速ファンクのベースを太くレゾナントさせたり、「レイブレーサー」のようなデステクノのドラムにダーティーな質感を与えるのに最適。"},{"id":"baby-audio-ba-1","developer":"Baby Audio","productName":"BA-1","mainCategory":"シンセサイザー / 音源","subCategory":"シンセサイザー","summary":"YAMAHA CS-01をモデルとしたFM音源搭載のポータブルアナログシンセサイザー。内蔵のエフェクトやLo-Fiモードが特徴。","usage":"【80sポータブルシンセの質感】 Future Funkのベースや、Chiptune Lo-Fi HipHopのリード音色に。CS-01特有の可愛らしい（ときに攻撃的な）チープさと、FMによる金属的な音色を活かし、長沼英樹サウンドのレイヤーに加える。"},{"id":"baby-audio-comeback-kid","developer":"Baby Audio","productName":"Comeback Kid","mainCategory":"エフェクター","subCategory":"ディレイ","summary":"モダンでクリアながら、サチュレーションやハイカット/ローカットでヴィンテージ感も出せるクリエイティブディレイ。","usage":"【高速ファンクのグルーヴ操作】 ディレイタイムを細かく設定し、高速ファンクのギターカッティングやパーカッションに挿入することで、リズミカルで複雑なグルーヴを生み出す。フィードバックで空間的広がりも演出。"},{"id":"baby-audio-super-vhs","developer":"Baby Audio","productName":"Super VHS","mainCategory":"エフェクター","subCategory":"マルチエフェクト","summary":"80年代のVHSテープやゲーム機材の質感を一発で再現するLo-Fiマルチエフェクト。Warble, Drive, Chorus, Reverbを搭載。","usage":"【80sノスタルジーの核】 Synthwaveのパッドや、Future Funkのボーカルサンプリングに必須。ノブ一つで「テープの揺れ（Warble）」と「汚れたコンソール（Drive）」を加えて、一気にレトロで暖かみのある質感に変換する。"},{"id":"baby-audio-taip","developer":"Baby Audio","productName":"TAIP","mainCategory":"エフェクター","subCategory":"テープサチュレーション","summary":"AIによるアナログテープモデリングサチュレーター。ヒスノイズやワウフラッターの調整が可能。","usage":"【ナムコサウンドの土台作り】 ドラムやシンセのバスに適用し、透明感を保ちつつ、音を太く、密度の高い80sサウンドに仕上げる。「F/A」や「レイブレーサー」のようなパンチの効いたダンスミュージックの「接着剤」として機能させる。"},{"id":"black-rooster-audio-cypress-tt-15","developer":"Black Rooster Audio","productName":"Cypress TT-15","mainCategory":"エフェクター","subCategory":"アンプシミュレーター","summary":"Orange Tiny Terrorをモデルにしたアンプシミュレーター。","usage":"【ギターアンプのジャリ感】 Orange Tiny Terrorをモデルにしたアンプシミュレーター。キャビネットシミュレーターと組み合わせて、Future Funkのカッティングギターに「ジャリッ」とした歪みとエッジを加える。"},{"id":"black-rooster-audio-magnetite","developer":"Black Rooster Audio","productName":"Magnetite","mainCategory":"エフェクター","subCategory":"テープシミュレーター","summary":"アナログテープの温かみとサチュレーションを付加する。","usage":"【ドラムの太さと粘り】 (※記入済かもしれませんが念のため) ドラムバスやベースに挿して、テープ特有の「低域の膨らみ」と「高域の丸み」を加える。UAD A800とは違う、よりガッツのあるロックな粘り気。"},{"id":"black-rooster-audio-ro-140","developer":"Black Rooster Audio","productName":"RO-140","mainCategory":"エフェクター","subCategory":"プレートリバーブ","summary":"物理的な「鉄板」を振動させるEMT 140の忠実なエミュレーション。","usage":"【ボーカルの艶出し】 City PopやAORスタイルのボーカルに最適。Lexiconのような広がりよりも「密度」と「輝き」を加え、歌声をオケの中でシルキーに際立たせる。スネアにかけてもアタックを潰さずに太さを出せる。"},{"id":"black-rooster-audio-ro-gold","developer":"Black Rooster Audio","productName":"RO-GOLD","mainCategory":"エフェクター","subCategory":"プレートリバーブ","summary":"RO-140（鉄板）よりもさらに密度が高く、温かい「金メッキ」プレート。","usage":"【至高のバラード・ボーカル】 RO-140（鉄板）よりもさらに密度が高く、温かい「金メッキ」プレート。金属的な癖がなく、ボーカルを包み込むようにリッチに響く。80'sバラードや、スローテンポのCity Popで「最も高級な音」が欲しい時に。"},{"id":"black-rooster-audio-the-canary","developer":"Black Rooster Audio","productName":"The Canary","mainCategory":"エフェクター","subCategory":"ドラムエンハンサー / トランジェント","summary":"ドラムの「アタック」や「高域成分」だけを強調・付加するツール。","usage":"【スネアの高域再生】 ドラムの「アタック」や「高域成分」だけを強調・付加するツール。サンプリングした古いスネアがこもっている時に、これで無理やり高域のパチパチ感を復活させる。"},{"id":"black-rooster-audio-vhl-3c","developer":"Black Rooster Audio","productName":"VHL-3C","mainCategory":"エフェクター","subCategory":"EQ","summary":"Pultec EQP-1AスタイルのパッシブEQ。音楽的なカーブが特徴。","usage":"【ビンテージ・ハイパス/ローパス】 (※記入済かもしれませんが) Pultecスタイルのフィルター。EQでいじる前に、不要な超低域や超高域を音楽的にカットして「おいしい帯域」だけを残す。アナログ的な位相特性が良い。"},{"id":"brainworx-bx-clipper","developer":"Brainworx","productName":"bx_clipper","mainCategory":"エフェクター","subCategory":"ダイナミクス","summary":"リミッターの手前でピークを叩き、透明なまま音圧を稼ぐ現代の必須ツール。FET/Diodeの使い分けで、滑らかな飽和から攻撃的な歪みまで自在。","usage":"【Speed Remix / Future Funkの音圧合戦】 リミッターだけで音圧を上げるとリズムが潰れてしまう時に。ドラムバスやマスター段でピークを数dB削るだけで、キックのアタック感を損なわずに海苔波形を作れる。Oxford Dynamicsで作ったグルーヴを、さらに「面」で前に出すための最終仕上げ。"},{"id":"brainworx-bx-digital-v3","developer":"Brainworx","productName":"bx_digital V3","mainCategory":"エフェクター","subCategory":"EQ (M/S)","summary":"M/S処理の世界的標準EQ。ミックスのステレオ感を精密に制御し、不要な帯域を整理するマスタリンググレードのツール。","usage":"【ミックスの外科医】 Future Funkで「サンプリング素材の広がり」を制御したり、Synthwaveのベースをモノラルに固めつつパッドだけを広げるのに必須。マスターやバスの最終段でMono Makerを使い、キックとベースの定位置を確保するだけでミックスの濁りが消える。"},{"id":"brainworx-bx-townhouse","developer":"Brainworx","productName":"bx_townhouse","mainCategory":"エフェクター","subCategory":"バスコンプ","summary":"伝説のスタジオ特注SSL系バスコンプ。本家より重心が低く、独特の粗さと粘りがある「魔法の接着剤」。","usage":"【2Mixの完全な接着】 Speed Remixでバラバラな素材をひとつの楽曲としてまとめ上げるための最終段（bx_clipperの手前）。アタックを強調しつつ全体を馴染ませ、Future Funk特有の「サンプリングの荒々しい一体感」を生み出す。"},{"id":"brainworx-bx-console-n","developer":"Brainworx","productName":"bx_Console N","mainCa